{
  "id": "thinking.model-018",
  "title": "沉没成本",
  "summary": "采用经济学和管理会计中“已经发生且无法收回的成本”定义。",
  "kind": "method",
  "scope": "general",
  "status": "general",
  "entrypoints": {
    "brief": "一分钟看懂.md",
    "detail": "明细.md",
    "examples": "案例.md",
    "sources": "README.md",
    "assets": "模型示意图.svg"
  },
  "requires": [],
  "related": []
}
