{
  "id": "thinking.model-006",
  "title": "非SR思维模型",
  "summary": "收到一句刺耳的评价，马上回击，可能把一次信息分歧变成关系冲突。",
  "kind": "method",
  "scope": "general",
  "status": "general",
  "entrypoints": {
    "brief": "一分钟看懂.md",
    "detail": "明细.md",
    "examples": "案例.md",
    "sources": "README.md",
    "assets": "模型示意图.svg"
  },
  "requires": [],
  "related": []
}
