{
  "id": "knowledge.case.aws",
  "title": "AWS：Amazon Bedrock Knowledge Bases",
  "summary": "评估 Bedrock 私有知识检索与生成，区分 Managed 和 Customer-managed 的存储、连接器与权限能力。",
  "kind": "reference",
  "scope": "company",
  "status": "general",
  "entrypoints": {
    "brief": "摘要.md",
    "detail": "README.md",
    "sources": "来源与适用边界.md"
  },
  "requires": [],
  "related": []
}
