{
  "id": "thinking.model-071",
  "title": "诺依曼思维",
  "summary": "原义待核实；复杂任务可以拆成若干部分，但“每一部分都正常”还不保证整体正常。",
  "kind": "reference",
  "scope": "general",
  "status": "reference",
  "entrypoints": {
    "brief": "一分钟看懂.md",
    "detail": "明细.md",
    "examples": "案例.md",
    "sources": "README.md",
    "assets": "模型示意图.svg"
  },
  "requires": [],
  "related": []
}
