{
  "id": "thinking.model-068",
  "title": "大道至简",
  "summary": "原义待核实；把一份流程删到只剩一句话，可能更难执行。",
  "kind": "reference",
  "scope": "general",
  "status": "reference",
  "entrypoints": {
    "brief": "一分钟看懂.md",
    "detail": "明细.md",
    "examples": "案例.md",
    "sources": "README.md",
    "assets": "模型示意图.svg"
  },
  "requires": [],
  "related": []
}
