{
  "id": "knowledge.case.karpathy-llm-wiki",
  "title": "Andrej Karpathy：LLM Wiki",
  "summary": "研究 LLM Wiki 的分层积累模式，按页面契约和维护闭环组织资料，评估 AI Coding 两轮任务中的受控更新与复用。",
  "kind": "reference",
  "scope": "general",
  "status": "general",
  "entrypoints": {
    "brief": "摘要.md",
    "detail": "README.md",
    "sources": "来源与适用边界.md",
    "examples": "案例-AI-Coding项目Wiki.md"
  },
  "requires": [],
  "related": ["knowledge.introduction"]
}
