{
  "id": "thinking.model-040",
  "title": "长尾效应",
  "summary": "采用克里斯·安德森讨论的商业长尾：大量低频需求在一定供给与发现条件下具有合计价值。",
  "kind": "method",
  "scope": "general",
  "status": "general",
  "entrypoints": {
    "brief": "一分钟看懂.md",
    "detail": "明细.md",
    "examples": "案例.md",
    "sources": "README.md",
    "assets": "模型示意图.svg"
  },
  "requires": [],
  "related": []
}
