{
  "id": "thinking.model-083",
  "title": "SMART原则",
  "summary": "“提高英语水平”表达了愿望，却很难安排今天做什么，也无法判断何时完成。",
  "kind": "method",
  "scope": "general",
  "status": "general",
  "entrypoints": {
    "brief": "一分钟看懂.md",
    "detail": "明细.md",
    "examples": "案例.md",
    "sources": "README.md",
    "assets": "模型示意图.svg"
  },
  "requires": [],
  "related": []
}
