{
  "id": "knowledge.graph-storage",
  "title": "知识图谱存储方案",
  "summary": "按表示模型、查询与治理要求比较 RDF、属性图、SQL 和文件存储，设计来源、版本、更新与权限边界。",
  "kind": "method",
  "scope": "general",
  "status": "general",
  "entrypoints": {
    "brief": "摘要.md",
    "detail": "README.md",
    "sources": "来源与适用边界.md"
  },
  "requires": [],
  "related": ["knowledge.kb-graph-ontology", "ontology.rdf", "ontology.owl"]
}
