{
  "id": "thinking.first-principles",
  "title": "第一性原理",
  "summary": "“同行都是这样做的”能提供参考，却不能证明只有这一种做法。",
  "kind": "method",
  "scope": "general",
  "status": "general",
  "entrypoints": {
    "brief": "一分钟看懂.md",
    "detail": "明细.md",
    "examples": "案例.md",
    "sources": "README.md",
    "assets": "模型示意图.svg"
  },
  "requires": [],
  "related": []
}
