{
  "id": "thinking.model-103",
  "title": "课题分离",
  "summary": "用于厘清自己的行动、他人的选择与共同责任，减少包办和过度讨好；分清后仍需协商支持与合作，不能推卸承诺或修复责任。",
  "kind": "method",
  "scope": "general",
  "status": "general",
  "entrypoints": {
    "brief": "一分钟看懂.md",
    "detail": "明细.md",
    "examples": "案例.md",
    "sources": "README.md",
    "assets": "模型示意图.svg"
  },
  "requires": [],
  "related": []
}
